bangla_speech,sylhet_bangla_speech,zero,few,cot,context,which one is best
তোমার আব্বু কেমন আছে?,তোমার আব্বা বালা আছইন নি?,তোঁয়ার আব্বু কিলা আছে?,তোমার আব্বা ভালা আছে?,তোমার আব্বু কেমন আসে?,তুমার আব্বা কিলা আছে নি?,Context
আমার বড় বোনের আজকে মন ভালো নেই,আমার বড় বইনর আইজ মন ভালা নায়,আমার বড় বইনর আইজ মন ভালা নাই।,আমার বড় বইনর আইজকু মন ভালা নায়,আমার বড় বইনের আইজ মন ভালা নাই।,আমার বড় বইনর আইজকু মন ভালা নায়।,Zero
তুমি কি আমাকে এই কাজটি করে দিতে পারবে?,তুমি কিতা মোরে এই কাজটা করাই দিতা পারবা নি?,তুঁই কি আমারে এই কামটা কইরা দিতা ফারবি?,তুমি কিতা আমারে এউ খাজটা খইরা দিতা ফারবা?,তুই কি আমারে এই কামটা কইরা দিতে পারবি?,তুমি কিতা মোরে অউ কামটা খরি দিতা পারবে নি?,Context
এই গরমে বাহিরে বের হতে ইচ্ছা করে না,এই গরমো বাইরে বাইর অইতে জানে কয় না,এই গরমত বাইরে বাইরা যাইতে মন নাকরে।,অউ গরমো বাইরে বাইরা যাইত ইচ্ছা খরের না,এই গরমে বাইরে বাইরতে ইচ্ছা করে না।,অউ গরমো বাইরে বাইরত ইচ্ছা করে না।,Context
তোমার সব কথাই ভুল,তোমার সব মাত ভুল,তোঁয়ার সব কথাই ভুল।,তোমার সব কথাই ভুল,তোমার সব কথাই ভুল।,তুমার হখল কথাউ ভুল।,Context
তোমার মত খারাপ ছেলে আমি আর একটাও দেখিনি,তোমার মত খারাফ পুয়া মুই আর একটাও দেখছি না,তোঁয়ার মত খারাপ ফোয়া আমি আর এটা দেখি নাই।,তোমার মতন খারাপ ফুয়া আমি আর এখটাও দেখি নাই,তোমার মত খারাপ ফুয়া আমি আর একটাও দেখিনাই।,তুমার লাখান খারাফ ফুয়া মুই আর এখটাউ দেখছি না।,Context
বিয়ের জন্য আম্মা আমার জন্য ছেলে খুজতাসে,বিয়ার লাগি মাই মুর লাগি ফুয়া খুজিরা,বিয়ার লাই আম্মা আমার লাই ফোয়া খোঁজতাছে।,বিয়ার লাই আম্মা আমার লাই ফুয়া খুজতাসে,বিয়ার লাই আম্মা আমার লাই ফুয়া খুঁজতাসে।,বিয়ার লাগি আম্মায় মোর লাগি ফুয়া খুজরা।,Context
আব্বা আমাকে গতকাল একটা ছেলের সাথে দেখা করতে বলেছিল,আব্বা মোরে গতকাল এক ফুয়ার লগে দেখা করতে কইছলা,আব্বা আমারে কাইল এটা ফোয়ার লগে দেখা করতে কইছিল।,আব্বা আমারে গতকাইল এখটা ফুয়ার লগে দেখা করাত কইছিল,আব্বা আমারে গতকাইল একটা ফুয়ার লগে দেখা করতে কইছিল।,আব্বা মোরে গতকাইল এখটা ফুয়ার লগে দেখা করাত কইছিল।,Context
ছেলেটিকে আমার একদমই ভালো লাগেনি,ফুয়াটারে মোর একদমই ভালা লাগে নাই,ফোয়াটারে আমার এক্কেবারে ভালা লাগে নাই।,ফুয়াটারে আমার এক্কেবারে ভালা লাগে নাই,ফুয়াটারে আমার একদমই ভালা লাগেনাই।,ফুয়াটারে আমার এখেবারেউ ভালা লাগে না।,Context
মেয়েটি গোলাপি রঙের শাড়ি পরে এসেছিল,ফুরিটা গোলাপি রঙের শাড়ি পরিয়া আইছিল,মাইয়াটি গোলাপি রঙর শাড়ি ফইরা আইছিল।,ফুড়িটায় গোলাপি রংগর শাড়ি পিন্দিয়া আইছিল,মাইয়াডা গোলাপি রঙের শাড়ি পইরা আইছিল।,ফুড়িটায় গোলাপি রংগর শাড়ি পিন্দিয়া আইছিল।,Context
আমার দুইদিন পরে বিয়ে হবে,আমার দুইদিন ফরে বিয়া অইবো,আমার দুইদিন ফরে বিয়া হইব।,আমার দুই দিন ফরে বিয়া অইব,আমার দুইদিন পরে বিয়া হইব।,আমার দুইদিন বাদে বিয়া অইবো।,Context
ছেলেটি এখন আর বিকালে খেলতে বের হয় না,ফুয়াটা এখন আর বিকালে খেলাত বারয় না,ফোয়াটি এহন আর বিকালত খেলতে বাইর নাহয়।,ফুয়াটায় এহন আর বিকালে খেইলতে বাইরে না,ফুয়াডা এহন আর বিকালে খেলতে বাইরে না।,ফুয়াটায় এখন আর বিকালত খেলাত বাইরে না।,Context
মেয়েটি সকালে ঘুম থেকে উঠেই পরতে বসে,ফুরিটা সকালে ঘুম থাকি উঠেই ফরাত বয়,মাইয়াটি সকালত ঘুম থাইক্কা উইঠা পড়তে বইসে।,ফুড়িটায় শকালে ঘুম থাইক্কা উইঠা পড়তে বয়,মাইয়াডা সকালে ঘুম থেকে উঠিয়াই পড়তে বইসে।,ফুড়িটায় বিয়ানে গুম থাকি উঠিয়া পড়াত বইয়া।,Context
আমার চাচা বিদেশ থেকে গতকাল বাংলাদেশে এসেছে,আমার চাচা বিদেশ থাকি গতকাল বাংলাদেশে আইছে,আমার চাচা বিদেশ থাইক্কা কাইল বাংলাদেশত আইছে।,আমার চাচা বিদেশ থাইক্কা গতকাইল বাংলাদেশে আইছে,আমার চাচা বিদেশ থেকে গতকাইল বাংলাদেশে আইছে।,আমার চাচা বিদেশ থাকি গতকাইল বাংলাদেশো আইছে।,Context
আমার বাসার দারওয়ান অনেক ভালো মানুষ,আমার বাসার দারওয়ান অনেক ভালা মানুষ,আমার বাসার দারোয়ান অনেক ভালা মানুষ।,আমার বাসার দারওয়ান বড় ভালা মানুষ,আমার বাসার দারোয়ান অনেক ভালা মানুষ।,আমার বাসার দারোয়ান বাক্কা ভালা মানুষ।,Context
আমার বন্ধু খুলনা ঘুরতে গিয়েছে,আমার বন্ধু খুলনা বেরানিত গেছইন,আমার বন্ধু খুলনা ঘুরতে গেছে।,আমার বন্ধু খুলনা ঘুইরত গেইছে,আমার বন্ধু খুলনা ঘুইরতে গেছে।,আমার বন্ধু খুলনা পাখানিত গেছে।,Context
আমার ঘুরতে অনেক ভালো লাগে,আমার বেরাইতে অনেক ভালা লাগে,আমার ঘুরতে অনেক ভালা লাগে।,আমার ঘুইরত বড় ভালা লাগে,আমার ঘুইরতে অনেক ভালা লাগে।,আমার পাখানিত বাক্কা ভালা লাগে।,Context
আমি বিদেশে গিয়ে অনেক ঘুরতে চাই,মুই বিদেশে গিয়া অনেক বেরাইতে চাই,আমি বিদেশত গিয়া অনেক ঘুরতে চাই।,আমি বিদেশে গিয়া বড় ঘুইরত চাই,আমি বিদেশে গিয়া অনেক ঘুইরতে চাই।,মুই বিদেশ গিয়া বাক্কা পাখানিত চাই।,Context
তুমি আমাকে বিরক্ত করো না,তুমি মোরে বিরক্ত করবা না,তুঁই আমারে বিরক্ত কর না।,তুমি আমারে বিরক্ত খরো না,তুই আমারে বিরক্ত করিস না।,তুমি মোরে বিরক্ত খরো নায়।,Context
তিনি আমাকে অনেক অপমান করেছে,তাইন মোরে অনেক অপমান করছইন,তিনি আমারে অনেক অপমান কইছে।,তিনি আমারে বড় অপমান খইছে,তিনি আমারে অনেক অপমান কইছে।,তাইন মোরে বাক্কা অপমান খরছে।,Context
আমার সকালে উঠে বই পরতে অনেক ভালো লাগে,মোর সকালে উঠিয়া বই পরতে অনেক ভালা লাগে,আমার সকালত উইঠা বই পড়তে অনেক ভালা লাগে।,আমার শকালে উইঠা বই পড়ত বড় ভালা লাগে,আমার সকালে উঠিয়া বই পড়তে অনেক ভালা লাগে।,আমার বিয়ানে উঠিয়া বই পড়াত বাক্কা ভালা লাগে।,Context
আমার ছোট ভাই একদমই পড়ালেখা করতে চায় না,মোর ছোট ভাই একদমই পড়ালেখা করতে চাইন না,আমার ছোট ভাই এক্কেবারে পড়ালেখা করতে চায় না।,আমার খুদা ভাই এক্কেবারে পড়ালেখা খরত চায় না,আমার ছোট ভাই একদমই পড়ালেখা করতে চায় না।,আমার ছুটো ভাউ এখেবারেউ পড়ালেখা খরতো চায় না।,Context
আমার ছোট ভাই বিদ্যালয়ে যেতে চায় না,মোর ছোট ভাই বিদ্যালয় যাইতে চায় না,আমার ছোট ভাই বিদ্যালয়ত যাইতে চায় না।,আমার খুদা ভাই বিদ্যালয়ে যাইত চায় না,আমার ছোট ভাই বিদ্যালয়ে যাইতে চায় না।,আমার ছুটো ভাউ ইস্কুলো যাইতো চায় না।,Context
আমার ছোট ভাইয়ের বিদ্যালয়ে গিয়ে পড়ালেখা করতে ভাল লাগে না,মোর ছোট ভাইয়র বিদ্যালয়ে গিয়া পড়ালেখা করতে ভালা লাগে নানি,আমার ছোট ভাইর বিদ্যালয়ত গিয়া পড়ালেখা করতে ভালা লাগে না।,আমার খুদা ভাইয়ের বিদ্যালয়ে গিয়া পড়ালেখা খরত ভালা লাগে না,আমার ছোট ভাইয়ের বিদ্যালয়ে গিয়া পড়ালেখা করতে ভালা লাগে না।,আমার ছুটো ভাউর ইস্কুল গিয়া পড়ালেখা খরতো ভালা লাগে না।,Context
আমি একদিন বিদ্যালয়ের মাঠে মাথা ঘুরিয়ে পরে গিয়েছিলাম,মুই একদিন বিদ্যালয়ের মাঠো মাথা ঘোরাইয়া ফরি গেছিলাম,আমি একদিন বিদ্যালয়র মাঠত মাথা ঘুইরা পইড়া গেছিলাম।,আমি এখদিন বিদ্যালয়র মাঠে মাথা ঘুরাইয়া পইড়া গেইছিলাম,আমি একদিন বিদ্যালয়ের মাঠে মাথা ঘুইরা পড়ি গেছিলাম।,মুই এখদিন ইস্কুলর মাঠো মাথা গুরাইয়া পড়ি গেছিলাম।,Context
আপনি কি আমাকে কোনদিনও ভালবাসবেন না ?,আফনে কিতা আমারে কোনোদিনও ভালা ফাইতা না,আফনে কি আমারে কুনদিনো ভালবাসবেন না?,আফনে কিতা আমারে কুনদিনও ভালবাসবেন না?,আপনে কি আমারে কোনদিনও ভালবাসবেন না?,আফনে কিতা মোরে কুনোদিন ভালা পাইবা নায় নি?,Context
আমার বন্ধু আজকে সকালে ফুটবল খেলেছে,আমার বন্ধু আইজকে সকালে ফুটবল খেলছে,আমার বন্ধু আইজ সকালত ফুটবল খেইলছে।,আমার বন্ধু আইজকু শকালে ফুটবল খেইলছে,আমার বন্ধু আইজ সকালে ফুটবল খেইলছে।,আমার বন্ধু আইজকু বিয়ানে ফুটবল খেলাইছে।,Context
তুমি আমার মনের কথা একদমই বুঝো না,তুমি আমার ভিতরর মাত একদমই বুঝো না,তুঁই আমার মনর কথা এক্কেবারে বুঝ না।,তুমি আমার মনর কথা এক্কেবারে বুঝো না,তুই আমার মনের কথা একদমই বুঝস না।,তুমি আমার মনর কথা এখেবারেউ বুজো না।,Context
আমার আম্মু অনেক ভালো রান্না করে,আমার মাই অনেক ভালা রান্দা করইন,আমার আম্মু অনেক ভালা রান্না করে।,আমার আম্মু বড় ভালা রান্না খরে,আমার আম্মু অনেক ভালা রান্না করে।,আমার আম্মায় বাক্কা ভালা রান্না করে।,Context
আমার বন্ধু এখন ঘুমাতে যাবে,আমার বন্ধু এখন হুতনো যাইবো,আমার বন্ধু এহন ঘুমাইতে যাইব।,আমার বন্ধু এহন ঘুমাইত যাইব,আমার বন্ধু এহন ঘুমাইতে যাইব।,আমার বন্ধু এখন গুমাইতো যাইবো।,Context
আমার ছোট বোন নাচতে পারে,আমার ছোট বোইন নাচতে ফারে,আমার ছোট বইন নাচতে পারে।,আমার খুদা বইন নাচত ফারে,আমার ছোট বইন নাচতে পারে।,আমার ছুটো বইন নাচতা পারে।,Context
আমার বন্ধু এইবার ছুটিতে রাজশাহী ঘুরতে যাবে,আমার বন্ধু এবার ছুটিতে রাজশাহী ফাকানিত যাইবো,আমার বন্ধু এইবার ছুটিত রাজশাহী ঘুরতে যাইব।,আমার বন্ধু এইবার ছুটিত রাজশাহী ঘুইরত যাইব,আমার বন্ধু এইবার ছুটিতে রাজশাহী ঘুইরতে যাইব।,আমার বন্ধু এইবার ছুটিত রাজশাহী পাখানিত যাইবো।,Context
আমার বন্ধু যাকে ভালবাসে সে রাজশাহী থাকে,আমার বন্ধু যারে ভালা ফায় হে রাজশাহী থাকে,আমার বন্ধু যারে ভালবাসে সে রাজশাহী থাকে।,আমার বন্ধু যারে ভালবাসে সে রাজশাহী থাকে,আমার বন্ধু যারে ভালবাসে সে রাজশাহী থাকে।,আমার বন্ধু যারে ভালা পায় হে রাজশাহী থাকে।,Context
মেয়েটি রাজশাহী থেকে আমার বড় ভাইয়ের সাথে দেখা করতে এসেছিল,ফুড়িটা রাজশাহী থাকি আমার বড় ভাইয়র লগে দেখা করাত আইছলা,মাইয়াটি রাজশাহী থাইক্কা আমার বড় ভাইর লগে দেখা করতে আইছিল।,ফুড়িটায় রাজশাহী থাইক্কা আমার বড় ভাইয়র লগে দেখা করাত আইছিল,মাইয়াডা রাজশাহী থেকে আমার বড় ভাইয়ের লগে দেখা করতে আইছিল।,ফুড়িটায় রাজশাহী থাকি আমার বড় ভাউর লগে দেখা করাত আইছিল।,Context
মেয়েটি এখন সিলেট যাবে,ফুড়িটা এখইন সিলট যাইবা,মাইয়াটি এহন সিলেট যাইব।,ফুড়িটায় এহন সিলেট যাইব,মাইয়াডা এহন সিলেট যাইব।,ফুড়িটায় এখন সিলেট যাইবো।,Context
আমার বড় ভাই এখন তাঁর বন্ধুদের সাথে সিগারেট খায় না,আমার বড় ভাই এখইন হের বন্ধুদের লগে সিগারেট খায় না,আমার বড় ভাই এহন তার বন্ধুগো লগে সিগারেট খায় না।,আমার বড় ভাই এহন তাঁর বন্ধুগো লগে সিগারেট খায় না,আমার বড় ভাই এহন তার বন্ধুগো লগে সিগারেট খায় না।,আমার বড় ভাউ এখন তার বন্ধুরার লগে সিগারেট খায় না।,Context
আপনি কি আমাকে আগে কোনদিন দেখেছেন ?,আফনে কিতা আমারে আগে কোনোদিন দেখছিলানি,আফনে কি আমারে আগে কুনদিন দেখছেন?,আফনে কিতা আমারে আগে কুনদিন দেখছেন?,আপনে কি আমারে আগে কোনদিন দেখছেন?,আফনে কিতা মোরে এর আগে কুনোদিন দেখছইন নি?,Context
আপনি কি আমাকে চিনতে পেরেছেন?,আফনে কিতা আমারে চিনইন নি,আফনে কি আমারে চিনতে ফারছেন?,আফনে কিতা আমারে চিনত ফারছেন?,আপনে কি আমারে চিনতে পারছেন?,আফনে কিতা মোরে চিনতা পারছইন নি?,Context
ছেলেটি আমাকে চিনতে পারল না,ফুয়াটায় আমারে চিনতে ফারলো না,ফোয়াটি আমারে চিনতে পারল না।,ফুয়াটায় আমারে চিনত ফারল না,ফুয়াডা আমারে চিনতে পারল না।,ফুয়াটায় মোরে চিনতা পারলা না।,Context
মেয়েটি তোমাকে চিনতে পারল না,ফুড়িটায় তোমারে চিনতে ফারলো না,মাইয়াটি তোঁয়ারে চিনতে পারল না।,ফুড়িটায় তোমারে চিনত ফারল না,মাইয়াডা তোমারে চিনতে পারল না।,ফুড়িটায় তুমারে চিনতা পারলা না।,Context
আমার এখন পড়ালেখা করা উচিত,আমার এখইন ফড়ালেখা করা উচিৎ,আমার এহন পড়ালেখা করা উচিত।,আমার এহন পড়ালেখা খরা উচিত,আমার এহন পড়ালেখা করা উচিত।,আমার এখন পড়ালেখা খরা উচিত।,Context
অনেক রাত হয়েছে এখন আমার ছোট বোন ঘুমাতে যাবে,অনেক রাইত অইছে এখইন আমার ছোট বোইন ঘুমাইতে যাইবো,অনেক রাইত হইছে এহন আমার ছোট বইন ঘুমাইতে যাইব।,বড় রাত অইছে এহন আমার খুদা বইন ঘুমাইত যাইব,"অনেক রাত হইছে, এহন আমার ছোট বইন ঘুমাইতে যাইব।",বাক্কা রাইত অইছে এখন আমার ছুটো বইন গুমাইতো যাইবো।,Context
আমাকে পরিক্ষার আগে সব কিছু নিয়ে পড়ালেখা করতে হবে,আমাকে পরিক্ষার আগে হকল কিছু নিয়া ফড়ালেখা করত অইবো,আমারে পরীক্ষার আগে সবকিছু লইয়া পড়ালেখা করতে হইব।,আমারে পরীক্ষার আগে সব কুনতা নিয়া পড়ালেখা খরত অইব,আমারে পরীক্ষার আগে সব কিছু নিয়া পড়ালেখা করতে হইব।,মোরে ফরিক্ষার আগে হখল কুনতা লইয়া পড়ালেখা খরা লাগবো।,Context
