আমার ছোট ভাই বিদ্যালয়ে গিয়ে বন্ধুদের সাথে গল্প করে,আমার ছোট ভাই বিদ্যালয় গিয়া বন্ধুদের লগে গল্প করইন,আমার ছোট ভাই বিদ্যালয়ত গিয়া বন্ধুগো লগে গল্প করে।,আমার খুদা ভাই বিদ্যালয়ে গিয়া বন্ধুগো লগে গল্প খরে,আমার ছোট ভাই বিদ্যালয়ে গিয়া বন্ধুগো লগে গল্প করে।,আমার ছুটো ভাউ ইস্কুল গিয়া বন্ধুরার লগে গফ করে।,Context
আমার বন্ধু বিদ্যালয়ের মাঠে প্রতিদিন ক্রিকেট খেলে,আমার বন্ধু বিদ্যালয়ের মাঠো ফতিদিন ক্রিকেট খেলইন,আমার বন্ধু বিদ্যালয়র মাঠত প্রতিদিন ক্রিকেট খেলে।,আমার বন্ধু বিদ্যালয়র মাঠে প্রতিদিন ক্রিকেট খেইলে,আমার বন্ধু বিদ্যালয়ের মাঠে প্রতিদিন ক্রিকেট খেলে।,আমার বন্ধু ইস্কুলর মাঠো ফত্তেকদিন ক্রিকেট খেলায়।,Context
একটি ছোট শিশু ফুটপাতে লাফাচ্ছে,একটা ছোট বাইচ্চা ফুটপাতে লাফাইরা,একটা ছোট শিশু ফুটপাতত লাফাইতাছে।,এখটা খুদা শিশু ফুটপাতে লাফাইতাছে,একটা ছোট বাচ্চা ফুটপাতে লাফাইতেছে।,এখটা ছুটো বাইচ্চা ফুটপাতত লাফাইরা।,Context
আমার বান্ধুবি তার স্বামীকে খুব ভালবাসে,আমার বান্ধবী তার স্বামীরে খুব ভালা ফায়,আমার বান্ধুবি তার শামীকে খুব ভালবাসে।,আমার বান্ধবী তাঁর শাওরে বড় ভালবাসে,আমার বান্ধুবি তার স্বামীরে খুব ভালবাসে।,আমার বান্ধবি তার জামাইরে বাক্কা ভালা পায়।,Context
আমার স্ত্রী আমাকে ভালোবাসে না,আমার স্ত্রী আমারে ভালা ফায় না,আমার বউ আমারে ভালবাসে না।,আমার বউ আমারে ভালবাসে না,আমার বউ আমারে ভালবাসে না।,আমার বউ মোরে ভালা পায় না।,Context
স্কুল জীবন থেকে আমার ভাইয়ের সাথে তোমার বোনের প্রেম ছিলো,স্কুল জীবন থাকি আমার ভাইয়র লগে তোমার বোইনর প্রেম আছিল,স্কুল জীবন থাইক্কা আমার ভাইর লগে তোঁয়ার বইনর প্রেম আছিল।,ইশকুল জীবন থাইক্কা আমার ভাইয়র লগে তোমার বইনর প্রেম আছিল,স্কুল জীবন থেকে আমার ভাইয়ের লগে তোমার বইনের প্রেম আছিল।,ইস্কুল জীবন থাকি আমার ভাউর লগে তুমার বইনর পিরিত আছিল।,Context
আমার গতকাল প্রচণ্ড মাথা ব্যথা করছিলো,আমার গতকাইল প্রচন্ড মাথা বেদনা করছিলো,আমার কাইল প্রচণ্ড মাথা ব্যথা করছিল।,আমার গতকাইল বড় মাথা ব্যথা খরতাছিল,আমার গতকাইল প্রচণ্ড মাথা ব্যথা করছিল।,আমার গতকাইল বাক্কা মাথাত বেদনা করছিল।,Context
আমি তোমার কোন কথা কিছুই বুঝতে পারলাম না,মুই তোমার কোন মাত কিচ্ছুই বুঝতে ফারলাম না,আমি তোঁয়ার কুন কথা কিছুই বুঝতে পারলাম না।,আমি তোমার কুন কথা কুনতাই বুঝত ফারলাম না,আমি তোমার কোন কথা কিছুই বুঝতে পারলাম না।,মুই তুমার কুনো কথা কুনতা বুঝতাম পারলাম না।,Context
তোমার হাশির কাছে আমার সব কিছু হার মেনে যায়,তোমার হাশির কাছে আমার হকল কিছু হার মানিয়া যায়,তোঁয়ার হাসির কাছে আমার সবকিছু হার মাইনা যায়।,তোমার হাঁশির কাছে আমার সব কুনতা হার মাইনা যায়,তোমার হাসির কাছে আমার সব কিছু হার মানি যায়।,তুমার হাসির কান্দাত আমার হখল কুনতা হার মানি যায়।,Context
তোমার চোখ দুটো অনেক সুন্দর,তোমার চোউক দুইটা অনেক সুন্দর,তোঁয়ার চোখ দুইটা অনেক সুন্দর।,তোমার চোখ দুইটা বড় শুন্দর,তোমার চোখ দুইটা অনেক সুন্দর।,তুমার চউক দুইটা বাক্কা সুন্দর।,Context
তোমার সাথে অনেক দিন পর দেখা,তোমার লগে অনেক দিন পর দেখা,তোঁয়ার লগে অনেক দিন ফরে দেখা।,তোমার লগে বড় দিন ফর দেখা,তোমার লগে অনেক দিন পর দেখা।,তুমার লগে বাক্কা দিন বাদে দেখা।,Context
ছেলেটি বিদেশে গিয়ে পড়ালেখা করার স্বপ্ন দেখে,ফুয়াটা বিদোশো গিয়া ফড়ালেখা করার স্বপ্ন দেখে,ফোয়াটি বিদেশত গিয়া পড়ালেখা করার স্বপ্ন দেখে।,ফুয়াটায় বিদেশে গিয়া পড়ালেখা খরার শপন দেখে,ফুয়াডা বিদেশে গিয়া পড়ালেখা করার স্বপ্ন দেখে।,ফুয়াটায় বিদেশ গিয়া পড়ালেখা খরার সফনো দেখে।,Context
তোমার সাথে কথা বলে আমার অনেক ভালো লাগলো,তোমার লগে মাতিয়া আমার অনেক ভালা লাগছে,তোঁয়ার লগে কথা কইয়া আমার অনেক ভালা লাগল।,তোমার লগে কথা কইয়া আমার বড় ভালা লাগল,তোমার লগে কথা কইয়া আমার অনেক ভালা লাগল।,তুমার লগে মাত মারিয়া আমার বাক্কা ভালা লাগলো।,Context
তোমার বন্ধুর সাথে পরিচিত হয়ে ভালো লাগলো,তোমার বন্ধুর লগে পরিচত হইয়া ভালা লাগলো,তোঁয়ার বন্ধুর লগে পরিচিত হইয়া ভালা লাগল।,তোমার বন্ধুর লগে পরিচিত অইয়া ভালা লাগল,তোমার বন্ধুর লগে পরিচিত হইয়া ভালা লাগল।,তুমার বন্ধুর লগে পরিচিত অইয়া ভালা লাগলো।,Context
আমার আব্বু আর চাচার মধ্যে জায়গা জমি নিয়ে ঝগড়া হয়,আমার আব্বু আর চাচার মধ্যে জায়গা জমি নিয়া মাইর অয়,আমার আব্বু আর চাচার মাঝত জায়গা জমি লইয়া ঝগড়া হয়।,আমার আব্বা আর চাচার মাঝে জায়গা জমি নিয়া ঝগড়া অয়,আমার আব্বু আর চাচার মইধ্যে জায়গা জমি নিয়া ঝগড়া হয়।,আমার আব্বা আর চাচার মাঝে জাগা জমিন লইয়া মাইর অয়।,Context
লোকটি কিছু দিন আগে বিয়ে করেন,লোকটা কিছুদিন আগে বিয়া করছইন,লোকটা কিছু দিন আগে বিয়া কইরছে।,লোকটা কুনতা দিন আগে বিয়া খরে,মানুষটা কিছু দিন আগে বিয়া কইছে।,বেটাটায় কুনতা দিন আগে বিয়া খরছে।,Context
প্রথমে তোমাকে একটি বইয়ের দোকানে যেতে হবে,প্রথমে তোমাকে একটা বইয়ের দোখানো যাইতে হইবো,প্রথমত তোঁয়ারে একটা বইয়ের দোকানত যাইতে হইব।,প্রথমে তোমারে এখটা বইয়র দোকানে যাইত অইব,প্রথমে তোমারে একটা বইয়ের দোকানে যাইতে হইব।,পয়লা তুমারে এখটা বইয়ের দুকানো যাওয়া লাগবো।,Context
বেশি কিছু বলার আগেই আবেগে চোখে পানি চলে আসছে,বেশি কিছু বলার আগেই আবেগে চোউক এর ফানি চলে আইতেছে,বেশি কিছু কওয়ার আগেই আবেগত চোখত পানি চইলা আইতাছে।,বেশি কুনতা কওয়ার আগেই আবেগে চোখে পানি চইলা আইতাছে,বেশি কিছু কওয়ার আগেই আবেগে চোখে পানি চইলা আইতেছে।,বেশি কুনতা কওয়ার আগেই আবেগে চকুত পানি আইরা।,Context
আপনার বন্ধুদের গালি দেওয়ার সুযোগ করে দিন,আফনার বন্ধুদের গালি দেওয়ার সুযোগ কইরা দিন,আফনার বন্ধুগো গালি দেওয়ার সুযোগ কইরা দেন।,আফনার বন্ধুগো গালি দেওয়ার সুযোগ খইরা দেন,আপনার বন্ধুগো গালি দেওয়ার সুযোগ কইরা দেন।,আফনার বন্ধুরারে গালি দিয়ার সুযোগ খরি দেউকা।,Context
অনেক মানুষ এখনো পেছনে লাইনে দাঁড়িয়ে আছে,অনেক মানুষ এখোনো পেছনো লাইনো দাঁড়িয়া আছইন,অনেক মানুষ এহনো পিছনে লাইনত দাঁড়াইয়া আছে।,বড় মানুষ এহনো পিছনে লাইনে দাঁড়াইয়া আছে,অনেক মানুষ এহনো পিছনে লাইনে দাঁড়িয়া আছে।,বাক্কা মানুষ এখনো পিছনে লাইনো উবানিত আছে।,Context
একজন মহিলা মারা গেছেন,একজন বেডি মারা গেছইন,একজন মহিলা মইরা গেছে।,এখজন মাইয়া মইরা গেইছে,একজন মাইয়া মানুষ মইরা গেছে।,এখজন বেটি মরি গেছইন।,Context
আপনি এত গরীব আগে কেন বলেননি,আফনি এত গরীব আগে কেনে কইলা না,আফনে এতো গরীব আগে ক্যান কন নাই?,আফনে এত গরীব আগে কেন কন নাই?,আপনে এত গরীব আগে ক্যান কন নাই?,আফনে এত্তো গরীব আগে কিয়েন কইছইন না নি?,Context
তুমি ছাড়া এই পৃথিবীতে আমার আর কেউ নেই,তুমি ছাড়া এই পৃথিবীতে আমার আর কেউ নাই,তুঁই ছাড়া এই দুনিয়াত আমার আর কেউ নাই।,তুমি ছাড়া এই পৃথিবীতে আমার আর কেউ নায়,তুই ছাড়া এই দুনিয়াতে আমার আর কেউ নাই।,তুমি ছাড়া এই দুনিয়াত আমার আর খেউ নাই।,Context
আমি আগেই বলেছি তোমাকে নিয়ে বিদেশ ঘুরতে চাই,মুই আগেই কইছলাম তোমারে নিয়া বিদেশ ফাকাইতে চাই,আমি আগেই কইছি তোঁয়ারে লইয়া বিদেশ ঘুরতে চাই।,আমি আগেই কইছি তোমারে নিয়া বিদেশ ঘুইরত চাই,আমি আগেই কইছি তোমারে নিয়া বিদেশ ঘুইরতে চাই।,মুই আগেই কইছি তুমারে লইয়া বিদেশ পাখানিত চাই।,Context
আমার আম্মু আমাকে সবার সামনে মারতে মারতে বাসায় নিয়ে আসে,আমার আম্মা আমাকে হকলের সামনে মারতে মারতে বাসাত নিয়া আইছে,আমার আম্মু আমারে সবার সামনে মাইরা মাইরা বাসাত লইয়া আইছে।,আমার আম্মু আমারে সবার সামনে মাইরত মাইরত বাসায় নিয়া আইছে,আমার আম্মু আমারে সবার সামনে মাইরা মাইরা বাসায় নিয়া আইছে।,আমার আম্মায় মোরে সবর সামনে মারতে মারতে বাসাত লইয়া আয়।,Context
আপনি কি জানেন এখানে অনেক ছেলে কমেন্ট পড়তে আসবে,আফনি কিতা জানেন এখানে অনেক ফুয়াইন কমেন্ট ফরাত আইবা,আফনে কি জানেন এহানে অনেক ফোয়া কমেন্ট পড়তে আইব?,আফনে কিতা জানেন এহানে বড় ফুয়া কমেন্ট পড়ত আইব?,আপনে কি জানেন এহানে অনেক ফুয়া কমেন্ট পড়তে আইব?,আফনে কিতা চিনইন এখানো বাক্কা ফুয়া কমেন্ট পড়াত আইবো নি?,Context
আবেগের ভালোবাসা কাউকে দেওয়া উচিত না,আবেগর ভালোবাসা কাউকে দেওয়া উচিৎ না,আবেগর ভালবাসা কারুকে দেওয়া উচিত না।,আবেগর ভালবাসা কারে দেওয়া উচিত না,আবেগের ভালবাসা কারোরে দেওয়া উচিত না।,আবেগর ভালা পাওয়া খেউরে দিয়া উচিত না।,Context
একদিন বিবেকের কাছে আবেগের ভালোবাসা হেরে যাবে,একদিন বিবেকের কাছে আবেগর ভালোবাসা হারিয়া যাইবো,একদিন বিবেকর কাছে আবেগর ভালবাসা হাইরা যাইব।,এখদিন বিবেকর কাছে আবেগর ভালবাসা হাইরা যাইব,একদিন বিবেকের কাছে আবেগের ভালবাসা হাইরা যাইব।,এখদিন বিবেকর কান্দাত আবেগর ভালা পাওয়া হারি যাইবো।,Context
আমার মনের ভালোবাসা চিরদিন তোমার জন্য থেকে যাবে,আমার মনের ভালোবাসা চিরদিন তোমার লাগি থাইকা যাইবো,আমার মনর ভালবাসা চিরদিন তোঁয়ার লাই থাইক্কা যাইব।,আমার মনর ভালবাসা চিরদিন তোমার লাই থাইক্কা যাইব,আমার মনের ভালবাসা চিরদিন তোমার লাই থাকি যাইব।,আমার মনর ভালা পাওয়া চিরদিন তুমার লাগি থাকি যাইবো।,Context
জীবনে একা একা পথ চলা অনেক কঠিন,জীবনে একলা একলা ফথ চলা অনেক কঠিন,জীবনত একা একা পথ চলা অনেক কঠিন।,জীবনে একা একা পথ চলা বড় কঠিন,জীবনে একা একা পথ চলা অনেক কঠিন।,জীবনো একলা একলা পত চলা বাক্কা কঠিন।,Context
আমার জীবন আমি তোমাকে নিয়ে বাঁচার জন্য দিব,আমার জীবন মুই তোমারে নিয়া বাঁচার লাগি দিমু,আমার জীবন আমি তোঁয়ারে লইয়া বাঁচার লাই দিম।,আমার জীবন আমি তোমারে নিয়া বাঁচার লাই দিম,আমার জীবন আমি তোমারে নিয়া বাঁচার লাই দিম।,আমার জীবন মুই তুমারে লইয়া বাঁচার লাগি দিতাম।,Context
আমার ভালবাসা দিয়ে সারাজীবন তোমার পাশে থাকতে চাই,আমার ভালুবাসা দিয়া হারাজীবন তোমার লগে থাকতে চাই,আমার ভালবাসা দিয়া সারাজীবন তোঁয়ার পাশে থাকতে চাই।,আমার ভালবাসা দিয়া সারাজীবন তোমার পাশে থাকত চাই,আমার ভালবাসা দিয়া সারাজীবন তোমার পাশে থাকতে চাই।,আমার ভালা পাওয়া দিয়া সারাজীবন তুমার পাশে থাকতাম চাই।,Context
তোমাকে কি করে বুঝাবো তোমাকে কতটা ভালবাসি?,তোমাকে কি করে বুঝাইমু তোমারে কতটা ভালো ফাই?,তোঁয়ারে কিলা কইরা বুঝামু তোঁয়ারে কত ভালবাসি?,তোমারে কিতা খইরা বুঝামু তোমারে কতটুক ভালবাসি?,তোমারে কি কইরা বুঝামু তোমারে কতটা ভালবাসি?,তুমারে কিলা বুঝাইতাম তুমারে কিত্তা ভালা পাই নি?,Context
আপনাকে দেখে আমি দেখে থমকে দারিয়ে ছিলাম,আফনারে দেইখ্খা মুই দেইখ্খা থমকে উবানিত আছলাম,আফনারে দেখি আমি দেখি থমকি দাঁড়াইয়া আছিলাম।,আফনারে দেখিয়া আমি দেখিয়া থমকিয়া দাঁড়াইয়া আছিলাম,আপনারে দেখিয়া আমি দেখিয়া থমকিয়া দাঁড়িয়া আছিলাম।,আফনারে দেকিয়া মুই দেকিয়া ভেমটালা লাগিয়া উবাই রইছলাম।,Context
আপনি খুব কষ্টে নিজেকে সামলে নিয়েছেন,আফনি খুব কষ্টে নিজরে সামলে নিয়াছইন,আফনে খুব কষ্টত নিজরে সামলাই নিছেন।,আফনে বড় কষ্টে নিজরে শামলাই নিছেন,আপনে খুব কষ্টে নিজেরে সামলাইছেন।,আফনে বাক্কা খষ্টে নিজোরে সামলাইয়া নিছইন।,Context
আমার বান্ধুবি কিছু ভাবতে পারেনা আপনাকে ছাড়া,আমার বান্ধবী কিচ্ছু ভাবতে ফারে না আফনাকে ছাড়া,আমার বান্ধুবি কিছু ভাবতে পারে না আফনারে ছাড়া।,আমার বান্ধবী কুনতা ভাবত ফারে না আফনারে ছাড়া,আমার বান্ধুবি কিছু ভাবতে পারে না আপনারে ছাড়া।,আমার বান্ধবি কুনতা ভাবতা পারে না আফনারে ছাড়া।,Context
আমার বন্ধু কিছু লিখতে পারেনা আপনার নাম ছাড়া,আমার বন্ধু কিচ্ছু লিখতে ফারে না আফনার নাম ছাড়া,আমার বন্ধু কিছু লিখতে পারে না আফনার নাম ছাড়া।,আমার বন্ধু কুনতা লিখত ফারে না আফনার নাম ছাড়া,আমার বন্ধু কিছু লিখতে পারে না আপনার নাম ছাড়া।,আমার বন্ধু কুনতা লেখতা পারে না আফনার নাম ছাড়া।,Context
আপনাকে ভালোবাসি এই কথাটি বলা বাকি,আফনারে ভালাফাই এই কথাটি বলার বাকি,আফনারে ভালবাসি এই কথাটি কওয়া বাকি।,আফনারে ভালবাসি এই কথাটা কওয়া বাকি,আপনারে ভালবাসি এই কথাডা কওয়া বাকি।,আফনারে ভালা পাই অউ কথাটা কওয়া বাকি।,Context
আমার আব্বুর খুব গরম লাগছে,আমার বাফর খুব গরম লাগছে,আমার আব্বুর খুব গরম লাগতাছে।,আমার আব্বুর বড় গরম লাগতাছে,আমার আব্বুর খুব গরম লাগতেছে।,আমার আব্বার বাক্কা গরমো লাগের।,Context
