আমার ছোট বোনের গরম লাগছে,আমার ছোট বোইনর গরম লাগছে,আমার ছোট বইনর গরম লাগতাছে।,আমার খুদা বইনর গরম লাগতাছে,আমার ছোট বইনের গরম লাগতেছে।,আমার ছুটো বইনর গরমো লাগের।,Context
এই শিশুটির অনেক ঠাণ্ডা লাগছে,এই শিশুটার অনেক ঠান্ডা লাগসে,এই শিশুটার অনেক ঠাণ্ডা লাগতাছে।,এই শিশুটার বড় ঠাণ্ডা লাগতাছে,এই বাচ্চাডার অনেক ঠাণ্ডা লাগতেছে।,অউ বাইচ্চাটার বাক্কা ঠান্ডা লাগের।,Context
আমার বন্ধুর খুব মন খারাপ,আমার বন্ধুর খুব বিতর খারাফ,আমার বন্ধুর খুব মন খারাপ।,আমার বন্ধুর বড় মন খারাপ,আমার বন্ধুর খুব মন খারাপ।,আমার বন্ধুর বাক্কা মন খারাফ।,Context
আম্মু আমার জন্য নীল শাড়ি কিনে এনেছে,মাই আমার লাগি নীল শাড়ি কেনিয়া আনছইন,আম্মু আমার লাই নীল শাড়ি কিনি আনছে।,আম্মু আমার লাই নীল শাড়ি কিনিয়া আনছে,আম্মু আমার লাই নীল শাড়ি কিনিয়া আনছে।,আম্মায় মোর লাগি নীল শাড়ি কিনিয়া আনছইন।,Context
আমি আমার বন্ধুকে একটি লাল গোলাপ কিনে উপহার দিয়েছি,মুই আমার বন্ধুকে একটা লাল গোলাফ কিনিয়া উপহার দিয়াছি,আমি আমার বন্ধুরে একটা লাল গোলাপ কিনি উপহার দিছি।,আমি আমার বন্ধুরে এখটা লাল গোলাপ কিনিয়া উপহার দিছি,আমি আমার বন্ধুরে একটা লাল গোলাপ কিনিয়া উপহার দিছি।,মুই আমার বন্ধুরে এখটা লাল গোলাপ কিনিয়া উপহার দিছি।,Context
আমি আমার স্বামীর সাথে বিকালে পার্কে ঘুরতে যাব,মুই আমার স্বামীর লগে বিয়ানে পার্কে ফাকানিত যাইমু,আমি আমার শামীর লগে বিকালত পার্কত ঘুরতে যাম।,আমি আমার শাওর লগে বিকালে পার্কে ঘুইরত যাম,আমি আমার স্বামীর লগে বিকালে পার্কে ঘুইরতে যাম।,মুই আমার জামাইর লগে বিকালত পার্কো পাখানিত যাইবো।,Context
কাউকে ভালোবাসা দেওয়াতেই বেশি আনন্দ লাগে আমার,কাউকে ভালোবাসা দেওয়াতেই বেশি কুশি লাগে আমার,কারুকে ভালবাসা দেওয়াতেই বেশি আনন্দ লাগে আমার।,কারে ভালবাসা দেওয়াতেই বেশি আনন্দ লাগে আমার,কারোরে ভালবাসা দেওয়াতেই বেশি আনন্দ লাগে আমার।,খেউরে ভালা পাওয়া দিয়াতেই বেশি মজা লাগে আমার।,Context
"যদি তুমি আমার কাছে ফিরে আস ,তবে তাকে ছেড়ে দাও","যদি তুমি আমার কাছে ফিরে আসো, তবে তাকে ছেড়ে দাও","যদি তুঁই আমার কাছে ফিরা আই, তাইলে তারে ছাইড়া দে।","যদি তুমি আমার কাছে ফিরা আইস, তই তারে ছাইড়া দে","যদি তুই আমার কাছে ফিরা আইস, তইলে তারে ছাইড়া দে।","যদি তুমি মোর কান্দাত ফিরি আও, তাইলে তারে ছাড়ি দেউকা।",Context
সে তোমার জন্য সব কিছু করতে পারে,সে তোমার লাগি সব কিছু করতে ফারে,সে তোঁয়ার লাই সবকিছু করতে পারে।,সে তোমার লাই সব কুনতা খরত ফারে,সে তোমার লাই সব কিছু করতে পারে।,হে তুমার লাগি হখল কুনতা খরতা পারে।,Context
আপনি যে মানুষটিকে ভালবাসবেন তাকে যদি না বুঝতে পারেন তাহলে আপনার এই প্রেমের কোনো অর্থ নেই,আফনি যে মানুষটাকে ভালাফাইবেন তাকে যদি না বুঝবার ফারইন তাহলে আফনার এই প্রেমের কোনো অর্থ নাই,আফনে যে মানুষটারে ভালবাসবেন তারে যদি না বুঝতে পারেন তাইলে আফনার এই প্রেমর কুনো অর্থ নাই।,আফনে যে মানুষটারে ভালবাসবেন তারে যদি না বুঝত ফারেন তই আফনার এই প্রেমর কুনো অর্থ নায়,"আপনে যে মানুষটারে ভালবাসবেন, তারে যদি না বুঝতে পারেন তাইলে আপনার এই প্রেমের কোনো অর্থ নাই।",আফনে যে মানুষরে ভালা পাইবা তারে যদি না বুঝতা পারইন তাইলে আফনার অউ পিরিতর কুনো মানে নাই।,Context
আপনি নিজে অসুখী হয়ে কিভাবে অন্যকে ভালোবেসে সুখী করবেন,আফনি নিজে অসুখী হয়ে কিলা অন্যকে ভালোবাসিয়া সুখী করবা,আফনে নিজে অসুখী হইয়া কিলা আরেকজনরে ভালবাইসা সুখী করবেন?,আফনে নিজে অসুখী অইয়া কিতা খইরা আরেকজনরে ভালবাসিয়া সুখী খরবেন?,আপনে নিজে অসুখী হইয়া কেমনে অন্যরে ভালবাইসা সুখী করবেন?,আফনে নিজে বেজার অইয়া কিলা আরেকরে ভালা পাইয়া খুশি খরবা নি?,Context
তুমি কারো জীবনে সুখ এনে দেবে এই ভেবে তোমার প্রেম করা উচিত,তুমি কারো জীবনে সুখ এনে দিবা এই ভেবে তোমার প্রেম করা উচিৎ,তুঁই কারো জীবনত সুখ আনি দিবি এই ভাইবা তোঁয়ার প্রেম করা উচিত।,তুমি কার জীবনে সুখ আনিয়া দিবা এই ভাইবা তোমার প্রেম খরা উচিত,তুই কারো জীবনে সুখ আনি দিবি এই ভাইবা তোমার প্রেম করা উচিত।,তুমি কারো জীবনো সুখ আনি দিবা অউ ভাবিয়া তুমার পিরিত খরা উচিত।,Context
আপনার মনের কথা গুলো আমাকে আজ খুলে বলুন,আফনার মনের মাত গুলা আমকে আজ খুলিয়া বলুন,আফনার মনর কথা গুলা আমারে আইজ খুইলা কন।,আফনার মনর কথা গুলা আমারে আইজ খুইলা কন,আপনার মনের কথাগুলা আমারে আইজ খুইলা কন।,আফনার মনর কথা গুইন মোরে আইজ খুলিয়া কইন।,Context
তুমি কখনই পারবে না অন্য কারও ভালোবাসাকে ছিনিয়ে নিতে,তুমি কখনোই ফারবা না অন্য কারও ভালুবাসাকে ছিনিয়া নিতে,তুঁই কখনো পারবি না আরেকজনর ভালবাসারে ছিনাইয়া নিতে।,তুমি কখনই ফারবা না আরেকজনর ভালবাসারে ছিনাইয়া নিতে,তুই কখনই পারবি না অন্য কারো ভালবাসারে ছিনাইয়া নিতে।,তুমি কুনোসময় পারবে না আরেকর ভালা পাওয়ারে ছিনাইয়া লইতো।,Context
তুমি জোর করে অন্যের ভালো লাগার মানুষ হতে পারবে না,তুমি জোর করে অন্যের ভালো লাগার হিতে ফারবা না,তুঁই জোর কইরা আরেকজনর ভালা লাগার মানুষ হইতে পারবি না।,তুমি জোর খইরা আরেকজনর ভালা লাগার মানুষ অইত ফারবা না,তুই জোর কইরা অন্যের ভালা লাগার মানুষ হইতে পারবি না।,তুমি জোর খরিয়া আরেকর ভালা লাগার মানুষ অইতা পারবে না।,Context
আগামিকাল সকালবেলা তাদেরকে দেখতে পাবেন,আগামীকাল সকালবেলা তাদেরকে দেখতে ফারবা,আগামিকাল সকালবেলা তাগো দেখতে পাইবেন।,আগামিকাইল শকালে তাগোরে দেখত ফারবেন,আগামিকাইল সকালবেলা তাগোরে দেখতে পাইবেন।,আগামিকাইল বিয়ানে তারারে দেখতা পাইবা।,Context
তোমার কোন কথাতেই কোনও নিশ্চয়তা নেই,তোমার কোনো মাতই কোনোও হদিস নাই,তোঁয়ার কুন কথাতেই কুনো নিশ্চয়তা নাই।,তোমার কুন কথাতেই কুনো নিশ্চয়তা নায়,তোমার কোন কথাতেই কোনো নিশ্চয়তা নাই।,তুমার কুনো কথাত কুনো নিশ্চয়তা নাই।,Context